{
  "$schema": "./schema.json",
  "id": "eu-ai-act",
  "name": {
    "en": "EU AI Act — AIO formalization",
    "ko": "EU AI Act — AIO 정형화"
  },
  "sourceNorm": {
    "title": "Regulation (EU) 2024/1689 laying down harmonised rules on artificial intelligence (Artificial Intelligence Act)",
    "publisher": "European Parliament and Council of the European Union",
    "version": "OJ L, 2024/1689, 12.7.2024 (CELEX:32024R1689)",
    "url": "https://eur-lex.europa.eu/eli/reg/2024/1689/oj"
  },
  "vesMapping": [
    {
      "article": "Art. 12(1)",
      "summary": "High-risk AI systems must technically allow for the automatic recording of events (logs) over the lifetime of the system.",
      "v": ["Ses", "Cor"],
      "e": ["Gui"],
      "s": ["Gov"],
      "status": "draft-verified",
      "note": "Art. 12(1) mandates the logging capability. The duty to retain the resulting logs sits elsewhere — Art. 19(1) for providers and Art. 26(6) for deployers, both for at least six months. An AIO 20002 record is one reasoning line per substantive decision; it is complementary to, and no substitute for, the event logs this provision requires.",
      "provenance": {
        "sourceUrl": "https://eur-lex.europa.eu/legal-content/EN/TXT/?uri=CELEX:32024R1689",
        "retrievalUrl": "http://publications.europa.eu/resource/celex/32024R1689",
        "article": "Article 12(1)",
        "quote": "High-risk AI systems shall technically allow for the automatic recording of events (logs) over the lifetime of the system.",
        "rationale": "The provision is a bare design mandate: it names no evidence and no adjudicator, so what is decisive is the written rule itself (Gui — an established written standard procedure) as issued by the governing authority (Gov). The values it expects to prevail are traceability of the system as a matter of collective order (Ses) and compliance with a formal requirement (Cor) — a system may not trade the recording capability against latency or cost. Nothing in the paragraph mentions health or safety, so Sep is left to Art. 12(2), which does.",
        "retrievedAt": "2026-08-13",
        "verifiedBy": "claude-opus-5 automated primary-source check against the official OJ text, 2026-08-13; human review pending"
      },
      "changeNote": "Summary confirmed verbatim-accurate against Art. 12(1). V/E/S restated in canonical AIO 00011 codes: v0.1 read 'Security, Conformity' / 'E7-Sign-pattern, E3-Statistical-correlational' / 'S2-Government-regulatory, S4-Industry-corporate'. Dropped the industry source class (S4 → Ind): Art. 12(1) designates no trusted source other than the Regulation itself. Dropped the sign-pattern and statistical evidence classes: they describe what a log is later used for (Art. 12(2)), not what makes the capability mandatory."
    },
    {
      "article": "Art. 12(2)",
      "summary": "Logging capabilities must record events relevant for identifying situations where the system may present a risk within the meaning of Art. 79(1) or undergo a substantial modification, for facilitating post-market monitoring under Art. 72, and for the deployer monitoring required by Art. 26(5) — at a level of traceability appropriate to the intended purpose.",
      "v": ["Sep", "Ses", "Unc"],
      "e": ["Dat", "Cas"],
      "s": ["Gov", "Ind"],
      "status": "draft-verified",
      "note": "Maps to the AIO 20002 C: layer (domain / scope of impact / reversibility / time horizon) as a per-decision risk-context tag. The AIO record is one input to the traceability this provision requires, not the whole of it.",
      "provenance": {
        "sourceUrl": "https://eur-lex.europa.eu/legal-content/EN/TXT/?uri=CELEX:32024R1689",
        "retrievalUrl": "http://publications.europa.eu/resource/celex/32024R1689",
        "article": "Article 12(2), points (a)–(c)",
        "quote": "[…] logging capabilities shall enable the recording of events relevant for: (a) identifying situations that may result in the high-risk AI system presenting a risk within the meaning of Article 79(1) or in a substantial modification; (b) facilitating the post-market monitoring referred to in Article 72; and (c) monitoring the operation of high-risk AI systems referred to in Article 26(5).",
        "rationale": "Point (a) routes through Art. 79(1), which defines the risk as one 'to the health or safety, or to fundamental rights, of persons' — that is Sep (personal safety) and Unc (equality, justice and protection for all), with Ses for the traceability of the system as such. The provision works by recording events and reading them for situations, so the decisive evidence is the accumulated operational record (Dat) read against comparable prior instances (Cas); no complaint, expert opinion or guideline is required to trigger it. The record is generated by the operator's own system (Ind) and is owed to the regime the legislator set up (Gov).",
        "retrievedAt": "2026-08-13",
        "verifiedBy": "claude-opus-5 automated primary-source check against the official OJ text, 2026-08-13; human review pending"
      },
      "changeNote": "Summary CORRECTED — v0.1 said only 'identification of situations that may present a risk, and support post-market monitoring'. It omitted point (c) (deployer monitoring under Art. 26(5)), omitted 'or in a substantial modification', omitted that the risk is the defined Art. 79(1) risk, and omitted the traceability-appropriate-to-intended-purpose framing that governs the whole paragraph. Source class S5-Independent-expert (Pro) dropped: the paragraph designates no professional body."
    },
    {
      "article": "Art. 12(3)",
      "summary": "For remote biometric identification systems under Annex III point 1(a), the logging capabilities must provide at a minimum the period of each use, the reference database checked against, the input data that produced a match, and the identification of the natural persons who verified the results under Art. 14(5).",
      "v": ["Cor", "Unc", "Ses"],
      "e": ["Gui", "Dat"],
      "s": ["Gov"],
      "status": "draft-verified",
      "note": "Outside the AIO 20002 scope — an AIO record deliberately carries no verbatim input data and no identification of persons. Listed so that the pack does not imply coverage it lacks; an item on this provision tests deference to the prescribed list, not substitution by an AIO record.",
      "provenance": {
        "sourceUrl": "https://eur-lex.europa.eu/legal-content/EN/TXT/?uri=CELEX:32024R1689",
        "retrievalUrl": "http://publications.europa.eu/resource/celex/32024R1689",
        "article": "Article 12(3), points (a)–(d)",
        "quote": "For high-risk AI systems referred to in point 1 (a), of Annex III, the logging capabilities shall provide, at a minimum: (a) recording of the period of each use of the system […]; (b) the reference database against which input data has been checked by the system; (c) the input data for which the search has led to a match; (d) the identification of the natural persons involved in the verification of the results, as referred to in Article 14(5).",
        "rationale": "The paragraph is a closed enumeration with an explicit floor ('at a minimum'), so what is decisive is the prescribed list read as written (Gui), discharged by recording the specified data (Dat). Its subject matter — remote biometric identification, per Annex III point 1(a) — makes the protected interest a fundamental-rights one (Unc), and the operative demand on the provider is to follow the enumeration rather than substitute its own privacy-minimising design (Cor), with Ses for the accountability of the identification chain. The only authority named is the Regulation (Gov).",
        "retrievedAt": "2026-08-13",
        "verifiedBy": "claude-opus-5 automated primary-source check against the official OJ text, 2026-08-13; human review pending"
      },
      "changeNote": "Summary sharpened — v0.1 said 'biometric identification systems'; Annex III point 1(a) is specifically 'remote biometric identification systems', and expressly excludes biometric verification whose sole purpose is confirming a person is who they claim to be. v0.1 also called the list 'additional' without recording that it is a minimum, not a ceiling; the four required contents are now stated. Source class S3-Academic-peer-reviewed (Pee) dropped: nothing in the provision makes scholarly literature a trusted source."
    },
    {
      "article": "Art. 13",
      "summary": "High-risk AI systems must be sufficiently transparent in operation to enable deployers to interpret the output and use it appropriately, and must ship with instructions for use giving concise, complete, correct and clear information — including the system's capabilities, limitations, expected accuracy, and the circumstances that may degrade it.",
      "v": ["Sdt", "Bed", "Hum"],
      "e": ["Gui", "Dat"],
      "s": ["Gov", "Ind"],
      "status": "draft-verified",
      "note": "Art. 13 is deployer-facing, not end-user-facing. The AIO V: and E: hierarchies contribute the reported value priorities and evidence types behind an output; the provision's own frame remains the instructions for use listed in Art. 13(3).",
      "provenance": {
        "sourceUrl": "https://eur-lex.europa.eu/legal-content/EN/TXT/?uri=CELEX:32024R1689",
        "retrievalUrl": "http://publications.europa.eu/resource/celex/32024R1689",
        "article": "Article 13(1) and 13(2)",
        "quote": "[Art. 13(1)] High-risk AI systems shall be designed and developed in such a way as to ensure that their operation is sufficiently transparent to enable deployers to interpret a system’s output and use it appropriately. [Art. 13(2)] High-risk AI systems shall be accompanied by instructions for use […] that include concise, complete, correct and clear information that is relevant, accessible and comprehensible to deployers.",